{
  "$schema": "../../../agent.schema.json",
  "schemaVersion": 1,
  "provider": "local-llama",
  "runtime": "ollama",
  "endpoint": "http://127.0.0.1:11434/v1/chat/completions",
  "defaultModel": "nemotron-3-ultra:cloud",
  "avatar": "avatar.png",
  "documentation": "https://ollama.com/library/nemotron-3-ultra",
  "runtimeDownload": "https://ollama.com/download",
  "models": [
    {
      "id": "nemotron-3-ultra:cloud",
      "label": "Nemotron 3 Ultra",
      "downloadBytes": 550000000000,
      "contextTokens": 262144
    }
  ]
}
